{
  "$schema": "https://json-schema.org/draft/2020-12/schema",
  "$id": "https://example.invalid/rust-service-kit/problem-details.schema.json",
  "title": "Service Problem Details",
  "type": "object",
  "required": [
    "type",
    "title",
    "status",
    "code",
    "request_id"
  ],
  "properties": {
    "type": {
      "type": "string",
      "format": "uri"
    },
    "title": {
      "type": "string",
      "minLength": 1
    },
    "status": {
      "type": "integer",
      "minimum": 400,
      "maximum": 599
    },
    "code": {
      "type": "string",
      "pattern": "^[A-Z][A-Z0-9_]*$"
    },
    "request_id": {
      "type": "string",
      "minLength": 1,
      "maxLength": 128
    },
    "detail": {
      "type": "string"
    },
    "instance": {
      "type": "string",
      "format": "uri-reference"
    },
    "errors": {
      "type": "array",
      "maxItems": 100,
      "items": {
        "type": "object",
        "required": [
          "pointer",
          "code",
          "message"
        ],
        "properties": {
          "pointer": {
            "type": "string"
          },
          "code": {
            "type": "string",
            "pattern": "^[a-z][a-z0-9_]*$"
          },
          "message": {
            "type": "string"
          }
        },
        "additionalProperties": false
      }
    }
  },
  "additionalProperties": true
}
